{
  "schema_version": "1.0",
  "type": "glossary",
  "slug": "cold-brew",
  "meta": {
    "title": "Cold brew — tè verde freddo",
    "description": "Il cold brew estrae il tè verde in acqua fredda per ore: meno tannini, più dolcezza, ideale per l'estate italiana e l'aperitivo analcolico.",
    "keywords": [
      "cold brew",
      "tè verde",
      "Camellia sinensis"
    ],
    "canonical_path": "/glossario/cold-brew/"
  },
  "seo": {
    "robots": "index,follow",
    "og_type": "article"
  },
  "navigation": {
    "related_slugs": [
      "cold-brew-gyokuro",
      "gyokuro"
    ],
    "temi_kb": [
      "preparazione_servizio",
      "caffeina_tannini"
    ],
    "controversie": [],
    "explore_next": [
      {
        "name": "Cold brew gyokuro",
        "url": "/varieta/cold-brew-gyokuro/",
        "reason": "scheda"
      },
      {
        "name": "Estate",
        "url": "/italia/stagioni/estate/",
        "reason": "stagione"
      },
      {
        "name": "Aperitivo",
        "url": "/italia/momenti/aperitivo/",
        "reason": "momento"
      }
    ]
  },
  "taxonomy": {},
  "body": {
    "blocks": [
      {
        "type": "level_section",
        "level": "intro",
        "blocks": [
          {
            "type": "paragraph",
            "spans": [
              {
                "type": "text",
                "value": "Il cold brew non è tè freddo zuccherato da supermercato. È pazienza: foglia in acqua fredda per ore, estrazione gentile, umami che emerge senza astringenza."
              }
            ]
          }
        ]
      },
      {
        "type": "level_section",
        "level": "deep",
        "blocks": [
          {
            "type": "heading",
            "level": 2,
            "spans": [
              {
                "type": "text",
                "value": "Estrazione fredda"
              }
            ]
          },
          {
            "type": "paragraph",
            "spans": [
              {
                "type": "text",
                "value": "Nel tè verde, Cold brew non è un'etichetta generica: ha storia, lavorazione e un profilo in tazza che lo distingue dalle altre voci del catalogo."
              }
            ]
          },
          {
            "type": "paragraph",
            "spans": [
              {
                "type": "text",
                "value": "Capire Cold brew ti aiuta a scegliere temperatura, momento della giornata e abbinamenti — senza trattare tutti i verdi come la stessa bevanda."
              }
            ]
          },
          {
            "type": "list",
            "ordered": false,
            "items": [
              {
                "spans": [
                  {
                    "type": "text",
                    "value": "4–8 ore in frigo per gyokuro"
                  }
                ]
              },
              {
                "spans": [
                  {
                    "type": "text",
                    "value": "Bassa caffeina relativa"
                  }
                ]
              },
              {
                "spans": [
                  {
                    "type": "text",
                    "value": "Ideale per estate italiana"
                  }
                ]
              }
            ]
          },
          {
            "type": "related_links",
            "items": [
              {
                "name": "Cold brew gyokuro",
                "url": "/varieta/cold-brew-gyokuro/",
                "reason": "scheda"
              },
              {
                "name": "Gyokuro",
                "url": "/glossario/gyokuro/",
                "reason": "foglia adatta"
              },
              {
                "name": "Estate",
                "url": "/italia/stagioni/estate/",
                "reason": "contesto"
              }
            ]
          },
          {
            "type": "faq",
            "items": [
              {
                "question": "Cold brew con acqua bollente raffreddata?",
                "answer_spans": [
                  {
                    "type": "text",
                    "value": "No: è estrazione a freddo dall'inizio; profilo diverso."
                  }
                ]
              }
            ]
          },
          {
            "type": "bibliography",
            "items": [
              {
                "author": "Pellegrino, Davide",
                "title": "Manuale per la preparazione del tè",
                "tema": "pellegrino-via-del-te",
                "sotto_tema": "Tè freddo e conservazione foglie",
                "pages": "69"
              },
              {
                "author": "Onuma, Izumi Forasté",
                "title": "El secreto japones del tè verde",
                "tema": "onuma-salute-pratica",
                "sotto_tema": "Tè prima dello sport, prima di dormire, a digiuno",
                "pages": "1202–1241"
              }
            ]
          }
        ]
      }
    ]
  }
}
