{
  "schema_version": "1.0",
  "type": "glossary",
  "slug": "matcha",
  "meta": {
    "title": "Matcha — definizione e usi",
    "description": "Matcha è polvere di tencha giapponese: bevi la foglia intera frullata in acqua, in cerimonia o in pasticceria.",
    "keywords": [
      "matcha",
      "tè verde",
      "Camellia sinensis"
    ],
    "canonical_path": "/glossario/matcha/"
  },
  "seo": {
    "robots": "index,follow",
    "og_type": "article"
  },
  "navigation": {
    "related_slugs": [
      "matcha"
    ],
    "temi_kb": [
      "cerimonia_spiritualita",
      "cucina_usi_pratici"
    ],
    "controversie": [],
    "explore_next": [
      {
        "name": "Matcha",
        "url": "/varieta/matcha/",
        "reason": "prova in tazza"
      },
      {
        "name": "Tencha",
        "url": "/glossario/tencha/",
        "reason": "materia prima"
      },
      {
        "name": "Chasen",
        "url": "/glossario/chasen/",
        "reason": "utensile essenziale"
      }
    ]
  },
  "taxonomy": {},
  "body": {
    "blocks": [
      {
        "type": "level_section",
        "level": "intro",
        "blocks": [
          {
            "type": "paragraph",
            "spans": [
              {
                "type": "text",
                "value": "Il matcha non si infusa e non si scarta: si scia, si frusta, si beve tutto. È tencha macinata, ombreggiata, senza le venature dell'arrotolamento del sencha."
              }
            ]
          }
        ]
      },
      {
        "type": "level_section",
        "level": "deep",
        "blocks": [
          {
            "type": "heading",
            "level": 2,
            "spans": [
              {
                "type": "text",
                "value": "Cerimonia e cucina"
              }
            ]
          },
          {
            "type": "paragraph",
            "spans": [
              {
                "type": "text",
                "value": "Tencha macinato, bevuto intero: catechine concentrate, gesto del chasen, usucha o koicha. In Italia è ingrediente pasticceria e bevanda trendy — due mondi, stessa polvere di origine diversa."
              }
            ]
          },
          {
            "type": "paragraph",
            "spans": [
              {
                "type": "text",
                "value": "Capire Matcha ti aiuta a scegliere temperatura, momento della giornata e abbinamenti — senza trattare tutti i verdi come la stessa bevanda."
              }
            ]
          },
          {
            "type": "list",
            "ordered": false,
            "items": [
              {
                "spans": [
                  {
                    "type": "text",
                    "value": "Usucha leggera e koicha densa in chanoyu"
                  }
                ]
              },
              {
                "spans": [
                  {
                    "type": "text",
                    "value": "Matcha da cucina ≠ cerimoniale"
                  }
                ]
              },
              {
                "spans": [
                  {
                    "type": "text",
                    "value": "Frusta chasen, non forchetta"
                  }
                ]
              }
            ]
          },
          {
            "type": "related_links",
            "items": [
              {
                "name": "Scheda matcha",
                "url": "/varieta/matcha/",
                "reason": "preparazione"
              },
              {
                "name": "Tencha",
                "url": "/glossario/tencha/",
                "reason": "materia prima"
              },
              {
                "name": "Chasen",
                "url": "/glossario/chasen/",
                "reason": "frusta"
              }
            ]
          },
          {
            "type": "faq",
            "items": [
              {
                "question": "Tutto il matcha verde in polvere è uguale?",
                "answer_spans": [
                  {
                    "type": "text",
                    "value": "No. Grado cerimoniale, da cucina e polveri zuccherate per latte sono mondi diversi."
                  }
                ]
              },
              {
                "question": "Matcha cerimoniale e da cucina?",
                "answer_spans": [
                  {
                    "type": "text",
                    "value": "Stessa pianta, qualità diverse: il culinary grade colora e profuma; il cerimoniale ha umami e dolcezza superiori in tazza."
                  }
                ]
              }
            ]
          },
          {
            "type": "bibliography",
            "items": [
              {
                "author": "Rosen, Diana",
                "title": "Il libro del tè verde",
                "tema": "rosen-lavorazione",
                "sotto_tema": "Lavorazione e varietà",
                "pages": "1575–1592"
              },
              {
                "author": "Onuma, Izumi Forasté",
                "title": "El secreto japones del tè verde",
                "tema": "onuma-matcha-cucina",
                "sotto_tema": "Matcha, pelle e riuso",
                "pages": "23–24"
              }
            ]
          }
        ]
      }
    ]
  }
}
