{
  "schema_version": "1.0",
  "type": "glossary",
  "slug": "catechine",
  "meta": {
    "title": "Catechine",
    "description": "Le catechine sono polifenoli antiossidanti del tè verde (Camellia sinensis), alla base del dibattito salute — senza promesse da integratore.",
    "keywords": [
      "catechine",
      "polifenoli",
      "antiossidanti",
      "tè verde",
      "Camellia sinensis"
    ],
    "canonical_path": "/glossario/catechine/"
  },
  "seo": {
    "robots": "index,follow",
    "og_type": "article"
  },
  "navigation": {
    "related_slugs": [
      "matcha",
      "gyokuro"
    ],
    "temi_kb": [
      "salute_catechine"
    ],
    "controversie": [],
    "explore_next": [
      {
        "name": "Salute: scienza vs tradizione",
        "url": "/impara/controversie/salute-scienza-vs-tradizione/",
        "reason": "dibattito aperto"
      },
      {
        "name": "EGCG",
        "url": "/glossario/egcg/",
        "reason": "composto chiave"
      },
      {
        "name": "Matcha",
        "url": "/varieta/matcha/",
        "reason": "bevi la polvere"
      },
      {
        "name": "Hub salute",
        "url": "/impara/salute/",
        "reason": "visione d'insieme"
      }
    ]
  },
  "taxonomy": {},
  "body": {
    "blocks": [
      {
        "type": "level_section",
        "level": "intro",
        "blocks": [
          {
            "type": "paragraph",
            "spans": [
              {
                "type": "text",
                "value": "Le catechine sono molecole che la foglia di tè accumula per difendersi dal sole. Nel tè verde restano abbondanti perché la lavorazione interrompe l'ossidazione prima che si trasformino in altri composti."
              }
            ]
          }
        ]
      },
      {
        "type": "level_section",
        "level": "deep",
        "blocks": [
          {
            "type": "heading",
            "level": 2,
            "spans": [
              {
                "type": "text",
                "value": "Nel tè verde"
              }
            ]
          },
          {
            "type": "paragraph",
            "spans": [
              {
                "type": "text",
                "value": "Il gruppo più studiato include l'EGCG — epigallocatechina gallato — ma ce ne sono altre, ognuna con un ruolo nel gusto e nella ricerca sulla salute."
              }
            ]
          },
          {
            "type": "paragraph",
            "spans": [
              {
                "type": "text",
                "value": "Famiglia di polifenoli antiossidanti: non solo EGCG. Temperatura e tempo modulano quanto finisce in tazza — acqua bollente estrae più amaro, non necessariamente «più salute» in modo lineare."
              }
            ]
          },
          {
            "type": "list",
            "ordered": false,
            "items": [
              {
                "spans": [
                  {
                    "type": "text",
                    "value": "Concentrate nel verde non ossidato rispetto al nero"
                  }
                ]
              },
              {
                "spans": [
                  {
                    "type": "text",
                    "value": "Legate all'amaro e all'astringenza in tazza"
                  }
                ]
              },
              {
                "spans": [
                  {
                    "type": "text",
                    "value": "Oggetto di trial clinici con cautela (hara)"
                  }
                ]
              }
            ]
          },
          {
            "type": "related_links",
            "items": [
              {
                "name": "EGCG",
                "url": "/glossario/egcg/",
                "reason": "catechina più studiata"
              },
              {
                "name": "Salute",
                "url": "/impara/salute/",
                "reason": "evidenze e limiti"
              },
              {
                "name": "Matcha",
                "url": "/varieta/matcha/",
                "reason": "foglia intera = più catechine"
              }
            ]
          },
          {
            "type": "faq",
            "items": [
              {
                "question": "Bevendo tè verde assumo sempre molte catechine?",
                "answer_spans": [
                  {
                    "type": "text",
                    "value": "Dipende da varietà, freschezza, temperatura e tempo. Il matcha, bevendo la polvere, ne concentra di più rispetto a un infusionato filtrato."
                  }
                ]
              },
              {
                "question": "Decaffeinazione perde catechine?",
                "answer_spans": [
                  {
                    "type": "text",
                    "value": "In parte sì: i processi industriali alterano anche polifenoli e profilo sensoriale."
                  }
                ]
              }
            ]
          },
          {
            "type": "bibliography",
            "items": [
              {
                "author": "Hara, Yukihiko (a cura di)",
                "title": "Health Benefits of Green Tea",
                "tema": "hara-anticancer",
                "sotto_tema": "Effetti anticancerogeni",
                "pages": "102–113"
              },
              {
                "author": "Rosen, Diana",
                "title": "Il libro del tè verde",
                "tema": "rosen-salute",
                "sotto_tema": "Salute e benessere",
                "pages": "2714–2838"
              },
              {
                "author": "Treccani",
                "title": "Enciclopedia on line",
                "tema": "treccani",
                "sotto_tema": "voce «antiossidante»",
                "pages": null,
                "kb_ref": "https://www.treccani.it"
              }
            ]
          }
        ]
      }
    ]
  }
}
