{
  "schema_version": "1.0",
  "type": "article",
  "slug": "scienza-tradizione",
  "meta": {
    "title": "Scienza o tradizione",
    "description": "Tre controversie dalla knowledge base: leggere il tè verde con spirito critico tra scienza, tradizione e vita quotidiana.",
    "keywords": [
      "scienza tradizione",
      "tè verde",
      "percorso",
      "Camellia sinensis"
    ],
    "canonical_path": "/gioca/percorsi/scienza-tradizione/"
  },
  "seo": {
    "robots": "index,follow",
    "og_type": "article"
  },
  "navigation": {
    "related_slugs": [],
    "temi_kb": [
      "preparazione_servizio"
    ],
    "controversie": [],
    "explore_next": [
      {
        "name": "Quiz miti",
        "url": "/gioca/quiz/mito-verita/",
        "reason": "metti alla prova"
      },
      {
        "name": "Salute",
        "url": "/impara/salute/",
        "reason": "approfondisci il tema"
      },
      {
        "name": "Bevanda vs integratore",
        "url": "/impara/controversie/bevanda-vs-integratore/",
        "reason": "tema aperto"
      },
      {
        "name": "Rituale quotidiano",
        "url": "/gioca/percorsi/rituale-quotidiano/",
        "reason": "continua a Gioca"
      }
    ]
  },
  "taxonomy": {},
  "body": {
    "blocks": [
      {
        "type": "level_section",
        "level": "intro",
        "blocks": [
          {
            "type": "paragraph",
            "spans": [
              {
                "type": "text",
                "value": "Il tè verde fa bene? Sì e no — dipende da cosa chiedi, a chi e con quale evidenza. Questo percorso attraversa tre dibattiti aperti senza fazioni."
              }
            ]
          },
          {
            "type": "paragraph",
            "spans": [
              {
                "type": "text",
                "value": "Durata: 35 minuti. Badge: Lettore critico."
              }
            ]
          },
          {
            "type": "list",
            "ordered": false,
            "items": [
              {
                "spans": [
                  {
                    "type": "text",
                    "value": "Salute: scienza (hara) vs tradizione (rosen, onuma)"
                  }
                ]
              },
              {
                "spans": [
                  {
                    "type": "text",
                    "value": "Bevanda vs integratore di EGCG"
                  }
                ]
              },
              {
                "spans": [
                  {
                    "type": "text",
                    "value": "Caffeina: stimolazione o calma?"
                  }
                ]
              }
            ]
          }
        ]
      },
      {
        "type": "level_section",
        "level": "deep",
        "blocks": [
          {
            "type": "heading",
            "level": 2,
            "spans": [
              {
                "type": "text",
                "value": "Cosa hai imparato"
              }
            ]
          },
          {
            "type": "paragraph",
            "spans": [
              {
                "type": "text",
                "value": "Tradizione e laboratorio convergono sul potenziale preventivo, divergono su dosi e certezze. Bevi per piacere; eventuali benefici sono un plus, non una promessa."
              }
            ]
          },
          {
            "type": "related_links",
            "items": [
              {
                "name": "Salute: scienza vs tradizione",
                "url": "/impara/controversie/salute-scienza-vs-tradizione/",
                "reason": "dibattito 1"
              },
              {
                "name": "Bevanda vs integratore",
                "url": "/impara/controversie/bevanda-vs-integratore/",
                "reason": "dibattito 2"
              },
              {
                "name": "Caffeina: stimolazione",
                "url": "/impara/controversie/caffeina-stimolazione/",
                "reason": "dibattito 3"
              },
              {
                "name": "Catechine",
                "url": "/glossario/catechine/",
                "reason": "lessico"
              }
            ]
          },
          {
            "type": "bibliography",
            "items": [
              {
                "author": "Hara, Yukihiko (a cura di)",
                "title": "Health Benefits of Green Tea",
                "tema": "hara-panoramica",
                "sotto_tema": "Prospettiva scientifica globale",
                "pages": "71–89"
              }
            ]
          }
        ]
      }
    ]
  }
}
